{
  "$schema": "https://json-schema.org/draft/2020-12/schema",
  "title": "recipe.schemaorg.v1 output",
  "description": "Output contract for pass2 schema extraction. Input may include normalized evidence helper fields, but output remains grounded in canonical evidence.",
  "type": "object",
  "additionalProperties": false,
  "required": [
    "bundle_version",
    "recipe_id",
    "schemaorg_recipe",
    "extracted_ingredients",
    "extracted_instructions",
    "field_evidence",
    "warnings"
  ],
  "properties": {
    "bundle_version": {
      "type": "string",
      "const": "1"
    },
    "recipe_id": {
      "type": "string",
      "minLength": 1
    },
    "schemaorg_recipe": {
      "type": "string",
      "description": "JSON-stringified Schema.org Recipe object (must parse as a JSON object).",
      "minLength": 2
    },
    "extracted_ingredients": {
      "type": "array",
      "items": {
        "type": "string"
      }
    },
    "extracted_instructions": {
      "type": "array",
      "items": {
        "type": "string"
      }
    },
    "field_evidence": {
      "type": "string",
      "description": "JSON-stringified evidence map (must parse as a JSON object).",
      "minLength": 2
    },
    "warnings": {
      "type": "array",
      "items": {
        "type": "string"
      }
    }
  }
}
