{"bundle_version":"1","recipe_id":"urn:recipeimport:epub:3d419982b11ed7c2503ba73deac8b6964c077c685dbd9ac199387b6a5504ed58:c6","schemaorg_recipe":"{\"@context\":\"https://schema.org\",\"@type\":\"Recipe\",\"name\":\"SLICES OF PORCINI MUSHROOMS WITH GRILLED ASPARAGUS JUICES\",\"recipeYield\":\"4\",\"recipeIngredient\":[\"1/4 cup/60 g high-quality unsalted butter\",\"2 ounces/60 g porcini mushrooms, roughly chopped\",\"14 large asparagus spears (about 210 g), trimmed\",\"Salt\",\"4 ounces/115 g porcini mushrooms\",\"1 teaspoon/5 g\",\"spinach purée\"]}","extracted_ingredients":["1/4 cup/60 g high-quality unsalted butter","2 ounces/60 g porcini mushrooms, roughly chopped","14 large asparagus spears (about 210 g), trimmed","Salt","4 ounces/115 g porcini mushrooms","1 teaspoon/5 g","spinach purée"],"extracted_instructions":[],"field_evidence":"{\"name\":{\"blocks\":[\"b263\"]},\"recipeYield\":{\"blocks\":[\"b266\",\"b267\"]},\"recipeIngredient\":{\"blocks\":[\"b269\",\"b270\",\"b272\",\"b273\",\"b275\",\"b276\",\"b277\"]},\"recipeInstructions\":\"No explicit instruction lines in evidence\"}","warnings":["No cooking instructions were present in the evidence, so recipeInstructions was omitted."]}