{"bundle_version":"1","recipe_id":"urn:recipeimport:epub:25814f413ce3cebb29af76fb45b8bef12928240886abe3d672e85f7e0be88761:c58","schemaorg_recipe":"{\"@context\":\"https://schema.org\",\"@type\":\"Recipe\",\"name\":\"EASY SKILLET-BRAISED CHICKEN WITH TOMATOES, OLIVES, AND CAPERS\",\"recipeYield\":\"4 TO 6\",\"description\":\"NOTE : You can make this dish entirely on the stovetop by lowering the heat to the lowest setting when you add the chicken in step 4, covering the pan, and cooking until the chicken is tender, about 45 minutes.\",\"recipeIngredient\":[\"4 to 6 chicken leg quarters\",\"Kosher salt and freshly ground black pepper\",\"1 tablespoon vegetable oil\",\"1 large onion, finely sliced (about 11/2 cups)\",\"2 cloves garlic, finely sliced\",\"1 tablespoon paprika\",\"1 tablespoon ground cumin\",\"1 cup dry white wine\",\"One 28-ounce can whole tomatoes, drained and crushed by hand\",\"1/2 cup homemade or low-sodium canned chicken stock\",\"1/4 cup capers, rinsed, drained, and roughly chopped\",\"1/4 cup chopped green or black olives\",\"1/4 cup fresh cilantro leaves\",\"1/4 cup lime juice (from 3 to 4 limes)\"],\"recipeInstructions\":[\"1. Adjust an oven rack to the lower-middle position and preheat the oven to 350°F. Lightly season the chicken legs with salt and pepper.\"]}","extracted_ingredients":["4 to 6 chicken leg quarters","Kosher salt and freshly ground black pepper","1 tablespoon vegetable oil","1 large onion, finely sliced (about 11/2 cups)","2 cloves garlic, finely sliced","1 tablespoon paprika","1 tablespoon ground cumin","1 cup dry white wine","One 28-ounce can whole tomatoes, drained and crushed by hand","1/2 cup homemade or low-sodium canned chicken stock","1/4 cup capers, rinsed, drained, and roughly chopped","1/4 cup chopped green or black olives","1/4 cup fresh cilantro leaves","1/4 cup lime juice (from 3 to 4 limes)"],"extracted_instructions":["1. Adjust an oven rack to the lower-middle position and preheat the oven to 350°F. Lightly season the chicken legs with salt and pepper."],"field_evidence":"{\"name\":[\"b1612\",\"b1613\"],\"recipeYield\":[\"b1615\"],\"description\":[\"b1614\"],\"recipeIngredient\":[\"b1615\"],\"recipeInstructions\":[\"b1616\"]}","warnings":["Ingredient list is provided in one concatenated line in source text and was segmented into individual lines only where obvious quantities/phrasing separated.","Only one numbered instruction is present in the provided evidence; the recipe likely omits additional steps."]}