{"bundle_version":"1","recipe_id":"urn:recipeimport:epub:3d419982b11ed7c2503ba73deac8b6964c077c685dbd9ac199387b6a5504ed58:c7","schemaorg_recipe":"{\"@context\":\"https://schema.org\",\"@type\":\"Recipe\",\"name\":\"MANY TYPES OF WILD BERRIES IN A BROTH OF HERBS AND GRASSES\",\"recipeYield\":\"4\",\"recipeIngredient\":[\"16 lemon balm tips\",\"16 angelica flowers\",\"16 oregano flowers\",\"16 wild geranium flowers\",\"1 ounce/25 g wheatgrass, roughly chopped\",\"1/2 ounce/13 g fresh dill\",\"1/2 cup/35 g parsley leaves\",\"2 tablespoons plus 2 teaspoons/40 g Stock syrup (\"]}","extracted_ingredients":["16 lemon balm tips","16 angelica flowers","16 oregano flowers","16 wild geranium flowers","1 ounce/25 g wheatgrass, roughly chopped","1/2 ounce/13 g fresh dill","1/2 cup/35 g parsley leaves","2 tablespoons plus 2 teaspoons/40 g Stock syrup ("],"extracted_instructions":[],"field_evidence":"{\"name\":{\"canonical_text\":\"MANY TYPES OF WILD BERRIES IN A BROTH OF HERBS AND GRASSES\"},\"recipeYield\":{\"blocks\":[\"b300\",\"b301\"]},\"recipeIngredient\":{\"blocks\":[\"b303\",\"b304\",\"b305\",\"b306\",\"b308\",\"b309\",\"b310\",\"b311\"]}}","warnings":["Stock syrup ingredient is split by page-marker blocks (\"page 256\" and \")\" on subsequent lines), so the ingredient text may be incomplete without those lines."]}