{"bundle_version":"1","recipe_id":"urn:recipeimport:epub:25814f413ce3cebb29af76fb45b8bef12928240886abe3d672e85f7e0be88761:c29","schemaorg_recipe":"{\"@context\":\"https://schema.org\",\"@type\":\"Recipe\",\"name\":\"TENDER FANCY-PANTS OMELET\",\"recipeYield\":\"SERVES 1\",\"recipeIngredient\":[\"3 large eggs\",\"1 large egg yolk\",\"1/2 teaspoon kosher salt\",\"1/4 teaspoon freshly ground black pepper\",\"1 tablespoon whole milk\",\"1 tablespoon chopped mixed fresh herbs, such as parsley, tarragon, and chives (optional)\",\"11/2 tablespoons unsalted butter, cut into 1/4-inch cubes and chilled\"],\"recipeInstructions\":[{\"@type\":\"HowToStep\",\"text\":\"1. Combine the eggs, egg yolk, salt, pepper, milk, and herbs, if using, in a medium bowl and whisk until homogeneous and frothy, about 1 minute. Allow to rest at room temperature for at least 15 minutes. The eggs should darken in color significantly.\"},{\"@type\":\"HowToStep\",\"text\":\"2. Add two-thirds of the butter to the eggs. Melt the remaining butter in an 8-inch nonstick skillet over low heat. Add the egg mixture to the skillet and cook, stirring slowly and constantly with a silicone spatula, scraping the eggs off the bottom and sides of the skillet, until the eggs have begun to set, about 2 minutes. Then continue cooking, stirring and scraping, until the eggs are just firm enough to hold their shape when you draw the spatula through them. Shake the pan to distribute the eggs evenly over the bottom and then, holding the handle so that the pan rests at a slight angle, rap the pan against the stove so that the eggs are thicker on one side of the pan than the other. Remove from the heat, cover, and let the eggs set to the desired consistency, about 1 minute.\"}]}","extracted_ingredients":["3 large eggs","1 large egg yolk","1/2 teaspoon kosher salt","1/4 teaspoon freshly ground black pepper","1 tablespoon whole milk","1 tablespoon chopped mixed fresh herbs, such as parsley, tarragon, and chives (optional)","11/2 tablespoons unsalted butter, cut into 1/4-inch cubes and chilled"],"extracted_instructions":["1. Combine the eggs, egg yolk, salt, pepper, milk, and herbs, if using, in a medium bowl and whisk until homogeneous and frothy, about 1 minute. Allow to rest at room temperature for at least 15 minutes. The eggs should darken in color significantly.","2. Add two-thirds of the butter to the eggs. Melt the remaining butter in an 8-inch nonstick skillet over low heat. Add the egg mixture to the skillet and cook, stirring slowly and constantly with a silicone spatula, scraping the eggs off the bottom and sides of the skillet, until the eggs have begun to set, about 2 minutes. Then continue cooking, stirring and scraping, until the eggs are just firm enough to hold their shape when you draw the spatula through them. Shake the pan to distribute the eggs evenly over the bottom and then, holding the handle so that the pan rests at a slight angle, rap the pan against the stove so that the eggs are thicker on one side of the pan than the other. Remove from the heat, cover, and let the eggs set to the desired consistency, about 1 minute."],"field_evidence":"{\"name\":\"blocks[0].text\",\"recipeYield\":\"blocks[1].text\",\"recipeIngredient\":\"blocks[1].text\",\"recipeInstructions\":[\"blocks[2].text\",\"blocks[3].text\"]}","warnings":[]}