{"bundle_version":"1","recipe_id":"urn:recipeimport:epub:3d419982b11ed7c2503ba73deac8b6964c077c685dbd9ac199387b6a5504ed58:c12","schemaorg_recipe":"{\"@context\":\"https://schema.org\",\"@type\":\"Recipe\",\"name\":\"SUMMER FLOWERS FROM THE FARM\",\"recipeYield\":\"4\",\"recipeIngredient\":[\"5 ounces/150 g nasturtium flowers\",\"1 tablespoon/17 g high-quality cider vinegar\",\"11/2 teaspoons/8 g Dijon mustard\",\"1/4 cup/25 g crushed ice\",\"1/2 cup/110 g cold grapeseed oil\",\"Salt\",\"1 pound/500 g pattypan squash\",\"Grapeseed oil\",\"Salt\",\"Verjus\",\"12 assorted basil leaves, such as Genovese, Thai, dark opal, purple ruffles, and spicy globe\",\"12 nasturtium leaves, about 1 inch/2.5 cm across\",\"20 perfect nasturtium flower petals\",\"8 zucchini blossoms, each torn into about 8 strips\"],\"recipeInstructions\":[\"Combine the nasturtium flowers, cider vinegar, Dijon, and ice in a blender. Blend on low until everything begins to catch in the blender, then switch to high to liquefy. Add the grapeseed oil slowly, as if making a mayonnaise, and blend until completely smooth, about 1 minute.\",\"Strain the mixture through a fine-mesh strainer into a small container on ice. Season sparingly with salt and refrigerate until ready to serve.\",\"Two hours before serving, prepare a grill for direct grilling. Coat the squash with oil and grill it whole, turning frequently, until the skin is blistered and charred and the center is completely soft. Remove it from the heat and once cool, crack the squash in half (like an egg), drop the halves into a Superbag, and squeeze the juice into a large bowl. Season the juice with salt and verjus, then add the basil, nasturtium leaves, nasturtium flower petals, and zucchini blossoms to the bowl and toss to dress them in the roasted squash juice.\",\"Place the dressed salad next to a tablespoon of nasturtium flower sauce on each small serving plate.\"]}","extracted_ingredients":["5 ounces/150 g nasturtium flowers","1 tablespoon/17 g high-quality cider vinegar","11/2 teaspoons/8 g Dijon mustard","1/4 cup/25 g crushed ice","1/2 cup/110 g cold grapeseed oil","Salt","1 pound/500 g pattypan squash","Grapeseed oil","Salt","Verjus","12 assorted basil leaves, such as Genovese, Thai, dark opal, purple ruffles, and spicy globe","12 nasturtium leaves, about 1 inch/2.5 cm across","20 perfect nasturtium flower petals","8 zucchini blossoms, each torn into about 8 strips"],"extracted_instructions":["Combine the nasturtium flowers, cider vinegar, Dijon, and ice in a blender. Blend on low until everything begins to catch in the blender, then switch to high to liquefy. Add the grapeseed oil slowly, as if making a mayonnaise, and blend until completely smooth, about 1 minute.","Strain the mixture through a fine-mesh strainer into a small container on ice. Season sparingly with salt and refrigerate until ready to serve.","Two hours before serving, prepare a grill for direct grilling. Coat the squash with oil and grill it whole, turning frequently, until the skin is blistered and charred and the center is completely soft. Remove it from the heat and once cool, crack the squash in half (like an egg), drop the halves into a Superbag, and squeeze the juice into a large bowl. Season the juice with salt and verjus, then add the basil, nasturtium leaves, nasturtium flower petals, and zucchini blossoms to the bowl and toss to dress them in the roasted squash juice.","Place the dressed salad next to a tablespoon of nasturtium flower sauce on each small serving plate."],"field_evidence":"{\"name\":\"canonical_text line 1 / block b443\",\"recipeYield\":\"canonical_text line containing 'SERVES 4' (block b448)\",\"recipeIngredient\":\"canonical_text ingredient lines in order: blocks b450-b463\",\"recipeInstructions\":\"canonical_text instruction lines: blocks b466-b471\"}","warnings":[]}