{"bundle_version":"1","recipe_id":"urn:recipeimport:epub:25814f413ce3cebb29af76fb45b8bef12928240886abe3d672e85f7e0be88761:c61","schemaorg_recipe":"{\"@context\":\"https://schema.org\",\"@type\":\"Recipe\",\"name\":\"EASY SKILLET-BRAISED CHICKEN WITH MUSHROOMS AND BACON\",\"description\":\"NOTE : You can make this dish entirely on the stovetop by lowering the heat to the lowest setting when you add the chicken in step 4, covering the pan, and cooking until the chicken is tender, about 45 minutes.\",\"recipeYield\":\"4 TO 6\",\"recipeIngredient\":[\"SERVES 4 TO 6 4 to 6 chicken leg quarters Kosher salt and freshly ground black pepper 1 tablespoon vegetable oil 3 ounces slab bacon, diced 5 ounces button mushrooms, cleaned and sliced (about 2 cups) 1 large shallot, finely sliced (about 1/2 cup) 2 cloves garlic, finely sliced 2 teaspoons fresh thyme leaves 1 tablespoon unsalted butter 1 tablespoon all-purpose flour 1 cup dry white wine 3 cups homemade or low-sodium canned chicken stock 1/2 cup heavy cream 2 tablespoons fresh parsley leaves\"],\"recipeInstructions\":[{\"@type\":\"HowToStep\",\"text\":\"1. Adjust an oven rack to the lower-middle position and preheat the oven to 350\u00096F. Lightly season the chicken legs with salt and pepper.\"},{\"@type\":\"HowToStep\",\"text\":\"2. Heat the oil in a 12-inch ovenproof skillet or saut\\u00e9 pan over high heat until lightly smoking. Using tongs, carefully add the chicken pieces skin side down. Cover with a splatter screen or partially cover with a lid to prevent splattering and cook, without moving it, until the chicken is deep golden brown and the skin is crisp, about 4 minutes. Flip the chicken pieces and cook until the second side is golden brown, about 3 minutes longer. Transfer the chicken to a large plate and set aside.\"},{\"@type\":\"HowToStep\",\"text\":\"3. Add the bacon to the skillet and cook, stirring frequently, until lightly browned, about 3 minutes. Transfer to a plate. Add the mushrooms and cook, using a wooden spoon to scrape up the browned bits from the bottom of the pan and then stirring frequently, until the mushrooms give up all of their liquid and start to sizzle, about 8 minutes. Add the shallots and garlic and cook, stirring, until fragrant, about 1 minute. Add the thyme and butter and cook until the butter is melted. Add the flour and cook, stirring constantly, for 30 seconds.\"},{\"@type\":\"HowToStep\",\"text\":\"4. Add the white wine and scrape up the browned bits from the bottom of the skillet. Add the chicken stock and bring to a boil. Nestle the chicken pieces into the stock and vegetables so that only the skin is showing. Cover the pan and transfer to the oven. Cook for 20 minutes, then remove the lid and continue to cook until chicken is falling-off-the-bone tender and the sauce is rich, about 20 minutes longer. Transfer the chicken to a serving platter.\"}]}","extracted_ingredients":["SERVES 4 TO 6 4 to 6 chicken leg quarters Kosher salt and freshly ground black pepper 1 tablespoon vegetable oil 3 ounces slab bacon, diced 5 ounces button mushrooms, cleaned and sliced (about 2 cups) 1 large shallot, finely sliced (about 1/2 cup) 2 cloves garlic, finely sliced 2 teaspoons fresh thyme leaves 1 tablespoon unsalted butter 1 tablespoon all-purpose flour 1 cup dry white wine 3 cups homemade or low-sodium canned chicken stock 1/2 cup heavy cream 2 tablespoons fresh parsley leaves"],"extracted_instructions":["1. Adjust an oven rack to the lower-middle position and preheat the oven to 350°F. Lightly season the chicken legs with salt and pepper.","2. Heat the oil in a 12-inch ovenproof skillet or sauté pan over high heat until lightly smoking. Using tongs, carefully add the chicken pieces skin side down. Cover with a splatter screen or partially cover with a lid to prevent splattering and cook, without moving it, until the chicken is deep golden brown and the skin is crisp, about 4 minutes. Flip the chicken pieces and cook until the second side is golden brown, about 3 minutes longer. Transfer the chicken to a large plate and set aside.","3. Add the bacon to the skillet and cook, stirring frequently, until lightly browned, about 3 minutes. Transfer to a plate. Add the mushrooms and cook, using a wooden spoon to scrape up the browned bits from the bottom of the pan and then stirring frequently, until the mushrooms give up all of their liquid and start to sizzle, about 8 minutes. Add the shallots and garlic and cook, stirring, until fragrant, about 1 minute. Add the thyme and butter and cook until the butter is melted. Add the flour and cook, stirring constantly, for 30 seconds.","4. Add the white wine and scrape up the browned bits from the bottom of the skillet. Add the chicken stock and bring to a boil. Nestle the chicken pieces into the stock and vegetables so that only the skin is showing. Cover the pan and transfer to the oven. Cook for 20 minutes, then remove the lid and continue to cook until chicken is falling-off-the-bone tender and the sauce is rich, about 20 minutes longer. Transfer the chicken to a serving platter."],"field_evidence":"{\"name\":[\"b1643\",\"b1644\"],\"description\":[\"b1645\"],\"recipeYield\":[\"b1646\"],\"recipeIngredient\":[\"b1646\"],\"recipeInstructions\":[\"b1647\",\"b1648\",\"b1649\",\"b1650\"]}","warnings":[]}