{"bundle_version":"1","recipe_id":"urn:recipeimport:epub:25814f413ce3cebb29af76fb45b8bef12928240886abe3d672e85f7e0be88761:c22","schemaorg_recipe":"{\"@context\":\"https://schema.org\",\"@type\":\"Recipe\",\"description\":\"COOK TIME\\nDESCRIPTION\\nBEST USES\\n1 to 3 minutes\\nOuter white set just enough to allow egg to retain its shape when carefully peeled\\nI use 1- or 2-minute eggs when I'm tossing the eggs with salad or pasta where the uncooked egg will emulsify with other ingredients; they're not pleasant to eat on their own.\\n4 minutes\\nWhite is opaque nearly all the way through but retains a bit of translucency next to the yolk; yolk is barely warm and completely raw\\nServe as a topping to vegetables or grains; place on top of blanched asparagus or green beans or in a bowl of noodle soup.\\n5 minutes\\nWhite is opaque but still quivering and barely set toward the yolk; yolk is warm but completely raw\\nBreakfast\\n6 minutes\\nWhite is opaque, firm all the way through; yolk is warm and starting to firm up at the edges\\nBreakfast\\n7 minutes\\nWhite is fully cooked and as hard as that of a hard-boiled egg; yolk is golden and liquid in the center but beginning to set around the edges\",\"recipeCategory\":\"Breakfast\"}","extracted_ingredients":[],"extracted_instructions":[],"field_evidence":"{\"description\":{\"blocks\":[\"b749\",\"b750\",\"b751\",\"b752\",\"b753\",\"b754\",\"b755\",\"b756\",\"b757\",\"b758\",\"b759\",\"b760\",\"b761\",\"b762\",\"b763\",\"b764\",\"b765\"]},\"recipeCategory\":{\"blocks\":[\"b760\",\"b763\"]}}","warnings":["No ingredient list was present in the provided evidence.","No explicit step-by-step cooking instructions were present in the provided evidence.","No explicit recipe title/name was present; recipe name was omitted.","Multiple cook-time values appear, but no single consolidated cooking time was extractable from the evidence."]}