{"bundle_version":"1","recipe_id":"urn:recipeimport:epub:3d419982b11ed7c2503ba73deac8b6964c077c685dbd9ac199387b6a5504ed58:c9","schemaorg_recipe":"{\"@context\":\"https://schema.org\",\"@type\":\"Recipe\",\"name\":\"WARM BLUEBERRIES AND AN ICE CREAM MADE FROM SWEET WOODRUFF\",\"description\":\"T his is one of my favorite desserts-the combination of a hot, malty stew of blueberries and cool woodruff ice cream works very well together. I love creating a balance between sweet and crunchy, hot and sticky, and cool and fresh.\\nThe ice cream is made with both fresh and dried woodruff, making it a dish that can only really be made in late summer, after we have harvested the first trimmings of woodruff for drying and it has regrown, flowering for the last time before it goes to seed in the early fall. It is important to use very high-quality milk whenever you make ice cream, as it is the main ingredient, and to treat the ice cream base as you might a fresh herb sauce-working quickly and keeping it very cold-to keep the flavors bright. Similarly, berries lose their flavor very quickly after picking, particularly in the case of blueberries; their texture also suffers as they age. It is important to make the extra effort to use the best berries available. For us, this means driving to a nearby farm several times a week to get berries picked that morning.\",\"recipeYield\":\"4\",\"recipeIngredient\":[\"2 fresh egg yolks from Riley Starks\",\"1 tablespoon plus 1/2 teaspoon/15 g dark syrup (\",\"page 256\",\")\",\"1 scant tablespoon/15 g squid ink\",\"11/4 cups/125 g sifted all-purpose flour\",\"1/4 cup/25 g sifted cornstarch\",\"1 tablespoon/10 g malt powder\",\"1/4 teaspoon/.75 g kosher salt\",\"1/2 cup plus 2 tablespoons/125 g high-quality unsalted butter, at room temperature\",\"3 tablespoons/30 g granulated sugar\",\"3 cups/790 g whole milk\",\"1/2 cup/125 g heavy cream\",\"1/2 cup/105 g granulated sugar\",\"3 tablespoons plus 1 teaspoon/65 g corn syrup\",\"6 cups/70 g roughly chopped woodruff sprigs, plus 24 sprigs for garnish\",\"2 tablespoons/30 g\"]}","extracted_ingredients":["2 fresh egg yolks from Riley Starks","1 tablespoon plus 1/2 teaspoon/15 g dark syrup (","page 256",")","1 scant tablespoon/15 g squid ink","11/4 cups/125 g sifted all-purpose flour","1/4 cup/25 g sifted cornstarch","1 tablespoon/10 g malt powder","1/4 teaspoon/.75 g kosher salt","1/2 cup plus 2 tablespoons/125 g high-quality unsalted butter, at room temperature","3 tablespoons/30 g granulated sugar","3 cups/790 g whole milk","1/2 cup/125 g heavy cream","1/2 cup/105 g granulated sugar","3 tablespoons plus 1 teaspoon/65 g corn syrup","6 cups/70 g roughly chopped woodruff sprigs, plus 24 sprigs for garnish","2 tablespoons/30 g"],"extracted_instructions":[],"field_evidence":"{\"name\":\"blocks[367].text\",\"description\":\"canonical_text paragraphs before 'SERVES'\",\"recipeYield\":\"blocks[370].text and blocks[371].text\",\"recipeIngredient\":[\"blocks[373].text\",\"blocks[374].text\",\"blocks[375].text\",\"blocks[376].text\",\"blocks[377].text\",\"blocks[378].text\",\"blocks[379].text\",\"blocks[380].text\",\"blocks[381].text\",\"blocks[382].text\",\"blocks[383].text\",\"blocks[385].text\",\"blocks[386].text\",\"blocks[387].text\",\"blocks[388].text\",\"blocks[389].text\",\"blocks[390].text\"]}","warnings":["Dark syrup quantity is split across separate blocks with an inserted page reference '(page 256)' and a closing ')', indicating OCR/formatting noise.","The final ingredient entry is incomplete in evidence ('2 tablespoons/30 g' with no described ingredient text).","No explicit step-by-step preparation instructions are present in the provided evidence; recipeInstructions omitted."]}