{"bundle_version":"1","recipe_id":"urn:recipeimport:epub:25814f413ce3cebb29af76fb45b8bef12928240886abe3d672e85f7e0be88761:c57","schemaorg_recipe":"{\"@context\":\"https://schema.org\",\"@type\":\"Recipe\",\"name\":\"ALL-AMERICAN POT ROAST WITH GRAVY\",\"recipeYield\":\"6 TO 8\",\"recipeIngredient\":[\"1 boneless chuck roast (about 5 pounds), pulled apart at the seam into 2 large chunks, excess fat and gristle trimmed\",\"Kosher salt and freshly ground black pepper\",\"2 tablespoons vegetable oil\",\"4 anchovy fillets\",\"2 medium cloves garlic, finely minced or grated on a Microplane (about 2 teaspoons)\",\"1 teaspoon Marmite\",\"1 tablespoon soy sauce\",\"2 tablespoons tomato paste\",\"2 large carrots, peeled and cut into 1- to 2-inch chunks\",\"2 stalks celery, cut into 1-inch chunks\",\"2 large onions, finely sliced (about 4 cups)\",\"2 tablespoons all-purpose flour\",\"1 bottle (750-ml) dry red wine\",\"4 cups homemade or low-sodium canned chicken stock\",\"1/4-ounce (1 packet) unflavored gelatin\",\"2 bay leaves\",\"4 sprigs fresh thyme\",\"1 pound russet baking potatoes (about 2 large), peeled and cut into 1- to 2-inch chunks\"],\"recipeInstructions\":[\"1. Adjust an oven rack to the lower-middle position and preheat the oven to 225°F. Pat the chuck roast dry and season it with salt and pepper. Tie kitchen twine tightly around each piece at 1-inch intervals to help it retain its shape.\",\"2. Heat the oil in a large Dutch oven over high heat until lightly smoking. Add the chuck and cook, turning occasionally, until well browned on all sides, about 8 to 10 minutes. Transfer the beef to a large bowl.\",\"3. Meanwhile, combine the anchovy fillets, garlic, Marmite, soy sauce, and tomato paste in a small bowl and mash with the back of a fork until a smooth, homogeneous paste is formed.\",\"4. Return the pot to medium-high heat, add the carrots and celery, and cook, stirring frequently, until the vegetables begin to brown around the edges, about 5 minutes. Add the onions and cook, stirring frequently, until very soft and light golden brown, about 5 minutes. Add the anchovy mixture and cook, stirring, until fragrant, about 1 minute. Add the flour and cook, stirring, until no dry flour remains, about 1 minute. Increase the heat to high and, whisking constantly, slowly add the wine. Bring to a simmer and cook until the wine is reduced by half, about 15 minutes.\",\"5. Meanwhile, pour the chicken stock into a large liquid measuring cup or a bowl and sprinkle the gelatin on top. Allow it to hydrate for 10 minutes.\",\"6. Add the gelatin and chicken stock, bay leaves, and thyme to the Dutch oven, return the beef to the pot, and bring the liquid to a simmer. Cover, place in the oven, and cook until the beef is completely tender (it should offer little to no resistance when you poke it with a cake tester or thin knife), about 3 hours; add the potatoes to the pot about 45 minutes before the beef is done. Remove the pot from the oven and allow to cool for 1 hour.\",\"7. Transfer the whole pot to the refrigerator and let rest at least overnight, or up to 5 nights.\",\"8. When ready to serve, carefully remove the hardened layer of fat from the top of the cooking liquid and discard. Transfer the meat to a cutting board. Discard the bay leaves and thyme sprigs. Bring the liquid to a boil over high heat and reduce it until coats the back of a spoon but doesn't taste heavy. Season to taste with salt and pepper.\",\"9. Meanwhile, remove the twine from the beef and slice it against the grain into 1/2-inch-thick pieces. Place the pieces in overlapping layers in a 12-inch skillet and add a few ladles of sauce to moisten them. Cover the skillet and set over medium-low heat, shaking occasionally, until the meat is heated through, about 15 minutes.\"]}","extracted_ingredients":["1 boneless chuck roast (about 5 pounds), pulled apart at the seam into 2 large chunks, excess fat and gristle trimmed","Kosher salt and freshly ground black pepper","2 tablespoons vegetable oil","4 anchovy fillets","2 medium cloves garlic, finely minced or grated on a Microplane (about 2 teaspoons)","1 teaspoon Marmite","1 tablespoon soy sauce","2 tablespoons tomato paste","2 large carrots, peeled and cut into 1- to 2-inch chunks","2 stalks celery, cut into 1-inch chunks","2 large onions, finely sliced (about 4 cups)","2 tablespoons all-purpose flour","1 bottle (750-ml) dry red wine","4 cups homemade or low-sodium canned chicken stock","1/4-ounce (1 packet) unflavored gelatin","2 bay leaves","4 sprigs fresh thyme","1 pound russet baking potatoes (about 2 large), peeled and cut into 1- to 2-inch chunks"],"extracted_instructions":["1. Adjust an oven rack to the lower-middle position and preheat the oven to 225°F. Pat the chuck roast dry and season it with salt and pepper. Tie kitchen twine tightly around each piece at 1-inch intervals to help it retain its shape.","2. Heat the oil in a large Dutch oven over high heat until lightly smoking. Add the chuck and cook, turning occasionally, until well browned on all sides, about 8 to 10 minutes. Transfer the beef to a large bowl.","3. Meanwhile, combine the anchovy fillets, garlic, Marmite, soy sauce, and tomato paste in a small bowl and mash with the back of a fork until a smooth, homogeneous paste is formed.","4. Return the pot to medium-high heat, add the carrots and celery, and cook, stirring frequently, until the vegetables begin to brown around the edges, about 5 minutes. Add the onions and cook, stirring frequently, until very soft and light golden brown, about 5 minutes. Add the anchovy mixture and cook, stirring, until fragrant, about 1 minute. Add the flour and cook, stirring, until no dry flour remains, about 1 minute. Increase the heat to high and, whisking constantly, slowly add the wine. Bring to a simmer and cook until the wine is reduced by half, about 15 minutes.","5. Meanwhile, pour the chicken stock into a large liquid measuring cup or a bowl and sprinkle the gelatin on top. Allow it to hydrate for 10 minutes.","6. Add the gelatin and chicken stock, bay leaves, and thyme to the Dutch oven, return the beef to the pot, and bring the liquid to a simmer. Cover, place in the oven, and cook until the beef is completely tender (it should offer little to no resistance when you poke it with a cake tester or thin knife), about 3 hours; add the potatoes to the pot about 45 minutes before the beef is done. Remove the pot from the oven and allow to cool for 1 hour.","7. Transfer the whole pot to the refrigerator and let rest at least overnight, or up to 5 nights.","8. When ready to serve, carefully remove the hardened layer of fat from the top of the cooking liquid and discard. Transfer the meat to a cutting board. Discard the bay leaves and thyme sprigs. Bring the liquid to a boil over high heat and reduce it until coats the back of a spoon but doesn't taste heavy. Season to taste with salt and pepper.","9. Meanwhile, remove the twine from the beef and slice it against the grain into 1/2-inch-thick pieces. Place the pieces in overlapping layers in a 12-inch skillet and add a few ladles of sauce to moisten them. Cover the skillet and set over medium-low heat, shaking occasionally, until the meat is heated through, about 15 minutes."],"field_evidence":"{\"name\":\"blocks b1564 and b1565\",\"recipeYield\":\"canonical_text: 'SERVES 6 TO 8'\",\"recipeIngredient\":\"block b1566\",\"recipeInstructions\":\"blocks b1567 through b1575\"}","warnings":[]}