{"bundle_version":"1","recipe_id":"urn:recipeimport:epub:25814f413ce3cebb29af76fb45b8bef12928240886abe3d672e85f7e0be88761:c35","schemaorg_recipe":"{\"@context\":\"https://schema.org\",\"@type\":\"Recipe\",\"name\":\"BASIC DRY PANCAKE MIX\",\"description\":\"Why buy a store-bought mix when homemade pancakes are so easy and so much better? You can use this mix immediately after putting it together or, better yet, do what I do: make a quadruple batch and store it in an airtight container in the pantry. That way, whenever you want to whip up a batch of pancakes, all you've got to do is add your wet ingredients, and you're ready to roll.\"}","extracted_ingredients":[],"extracted_instructions":[],"field_evidence":"{\"name\":{\"source\":\"blocks[0].text\"},\"description\":{\"source\":\"blocks[1].text\"},\"ingredients\":{\"status\":\"not_present_in_evidence\"},\"instructions\":{\"status\":\"not_present_in_evidence\"}}","warnings":["No explicit ingredient or instruction blocks are present; only title and descriptive text were available."]}