{"bundle_version":"1","recipe_id":"urn:recipeimport:epub:3d419982b11ed7c2503ba73deac8b6964c077c685dbd9ac199387b6a5504ed58:c1","schemaorg_recipe":"{\"@context\":\"https://schema.org\",\"@type\":\"Recipe\",\"name\":\"A PORRIDGE OF LOVAGE STEMS\",\"description\":\"I had never cooked with lovage before moving to Denmark, but it's an amazing herb that grows rampant on Lummi. Here, we started by using the plant for several dishes, making infusions from the leaves and turning the seeds into capers, but we always had a large bin of lovage stems that ended up in the compost heap.\\nIn the spring, lovage is tender and subtle, an almost entirely different plant than it is later in the year. This dish is best prepared before the plant bolts and flowers, when the stems are crisp, juicy, and pleasant to eat raw. The preparation resembles a risotto, with the lovage stems in place of rice, gradually softened while cooking in a smoky smelt stock. The consistency should be similar to risotto, too, with a creaminess achieved by mixing in a thick pur\\u00e9e of blanched spinach and adding a knob of butter at the end. This porridge can easily be a stand-alone dish, but I tend to serve it alongside some caramelized shellfish, such as razor clams or small squid.\\nThe smelt stock used in this porridge is a good one, something of a mother sauce here at The Willows. We clean, salt, smoke, and dry the small fish before infusing them into a broth with dried mushrooms.\",\"recipeYield\":\"SERVES 6 TO 8\",\"recipeIngredient\":[\"3 scallions\",\"1/3 cup/80 g smelt stock (page 247)\",\"1 cup/90 g lovage stems, cut into 1/4-inch/.5 cm lengths\",\"1 cup/12 g lovage leaves, torn into pieces smaller than 1 inch/2.5 cm\",\"1/2 cup/45 g rainbow chard stems, cut into 1/4-inch/.5 cm cubes\",\"1/2 cup/50 g rainbow chard leaves, torn into thumb-sized pieces\",\"Salt\",\"1 tablespoon/15 g high-quality unsalted butter\",\"1 tablespoon/15 g spinach pur\\u00e9e (page 247)\",\"2 tablespoons/12 g chopped fermented green garlic (page 240)\",\"Reduced white wine (page 251)\",\"Verjus\",\"Lovage oil (page 242)\"],\"recipeInstructions\":[{\"@type\":\"HowToStep\",\"text\":\"Prepare a grill for direct grilling. Char the scallions over direct heat on the grill until well blackened, then finely chop them.\"},{\"@type\":\"HowToStep\",\"text\":\"Bring the smelt stock to a boil in a medium saucepan over medium-high heat. Add the lovage stems and lovage leaves, along with the chard stems and chard leaves. Cook the mixture, stirring frequently, until only about a tablespoon of the liquid remains and the leaves are a nice, glowing green, 3 to 5 minutes. Remove from the heat, season with salt, and stir in the butter. Return to the heat and stir in the spinach pur\\u00e9e until a nice, creamy sheen forms. Off the heat, stir in the scallions and fermented green garlic and season with reduced wine, verjus, and salt.\"},{\"@type\":\"HowToStep\",\"text\":\"Put a spoonful of porridge in the center of a dish and drizzle it with lovage oil.\"}]}","extracted_ingredients":["3 scallions","1/3 cup/80 g smelt stock (page 247)","1 cup/90 g lovage stems, cut into 1/4-inch/.5 cm lengths","1 cup/12 g lovage leaves, torn into pieces smaller than 1 inch/2.5 cm","1/2 cup/45 g rainbow chard stems, cut into 1/4-inch/.5 cm cubes","1/2 cup/50 g rainbow chard leaves, torn into thumb-sized pieces","Salt","1 tablespoon/15 g high-quality unsalted butter","1 tablespoon/15 g spinach pur\u0000e9e (page 247)","2 tablespoons/12 g chopped fermented green garlic (page 240)","Reduced white wine (page 251)","Verjus","Lovage oil (page 242)"],"extracted_instructions":["Prepare a grill for direct grilling. Char the scallions over direct heat on the grill until well blackened, then finely chop them.","Bring the smelt stock to a boil in a medium saucepan over medium-high heat. Add the lovage stems and lovage leaves, along with the chard stems and chard leaves. Cook the mixture, stirring frequently, until only about a tablespoon of the liquid remains and the leaves are a nice, glowing green, 3 to 5 minutes. Remove from the heat, season with salt, and stir in the butter. Return to the heat and stir in the spinach pur\u0000e9e until a nice, creamy sheen forms. Off the heat, stir in the scallions and fermented green garlic and season with reduced wine, verjus, and salt.","Put a spoonful of porridge in the center of a dish and drizzle it with lovage oil."],"field_evidence":"{\"name\":\"b99\",\"description\":{\"lines\":[\"b100\",\"b101\",\"b102\"]},\"recipeYield\":\"b103\",\"recipeIngredient\":[\"b104\",\"b105\",\"b106\",\"b107\",\"b108\",\"b109\",\"b110\",\"b111\",\"b112\",\"b113\",\"b114\",\"b115\",\"b116\"],\"recipeInstructions\":[\"b117\",\"b118\",\"b120\"]}","warnings":[]}