{"bundle_version":"1","recipe_id":"urn:recipeimport:epub:25814f413ce3cebb29af76fb45b8bef12928240886abe3d672e85f7e0be88761:c49","schemaorg_recipe":"{\"@context\":\"https://schema.org\",\"@type\":\"Recipe\",\"name\":\"Extra-Cheesy Grilled Cheese Sandwiches\",\"description\":\"I usually use a slice each of American and cheddar cheese, forgoing a category B cheese. Serve half a sandwich per person with the soup, or double this recipe and make the sandwiches in two skillets. (If you have only one skillet, make the sandwiches in batches and keep the first batch warm in a low oven, on a rack on a baking sheet.)\\nNOTE : Category A cheeses are good melting cheeses like American, cheddar, Jack, Fontina, young Swiss, Gruyère, Muenster, young provolone, and young Gouda, among others. Category B cheeses are strongly flavored grating cheeses like Parmigiano-Reggiano, Asiago, Pecorino, aged Manchego, and aged Gouda.\",\"recipeYield\":\"2 SANDWICHES\",\"recipeIngredient\":[\"2 tablespoons unsalted butter\",\"4 slices high-quality white, whole wheat, or rye sandwich bread\",\"4 ounces sliced Category A cheese (see Note above)\",\"Kosher salt\",\"1/2 ounce category B cheese, grated (optional; see Note above)\",\"Brown mustard\"],\"recipeInstructions\":[\"1. Melt 1/2 tablespoon of the butter in a 12-inch stainless steel or cast-iron skillet over medium heat. Add 2 bread slices and swirl them around the pan with your hands until all the butter is absorbed. Cook, swirling the bread occasionally, until very lightly browned, about 1 minute. Remove to a cutting board, toasted side up, and immediately top with the sliced A cheese. Melt another 1/2 tablespoon butter in the skillet and toast the remaining 2 bread slices until lightly browned, then immediately press them toasted side down onto the cheese-topped slices to form sandwiches.\",\"2. Melt another 1/2 tablespoon butter in the skillet and sprinkle with a pinch of salt. Reduce the heat to medium-low and place the sandwiches in the skillet. Swirl them around with your hands until all the butter is absorbed. Cook the sandwiches, swirling them with your hands and pressing down on them gently with a wide stiff spatula occasionally, until the bottoms are a deep, even golden brown, about 4 minutes. Remove the sandwiches to your cutting board with the spatula. Melt the remaining 1/2 tablespoon butter in the skillet, sprinkle with a bit of salt, and repeat the toasting procedure with the second side, until the sandwiches are golden brown on both sides and the cheese is thoroughly melted, about 4 minutes longer. Transfer the sandwiches to the cutting board.\",\"3. If desired, spread the grated cheese evenly over a large plate. Press the sandwiches into the grated cheese, turning once and pressing on them until you get an even coating of cheese on both sides. Return the sandwiches to the skillet and cook until the grated cheese has melted and formed a golden brown crust, about 1 minute. Carefully flip the sandwiches and repeat with the second side. Transfer to the cutting board.\"]}","extracted_ingredients":["2 tablespoons unsalted butter","4 slices high-quality white, whole wheat, or rye sandwich bread","4 ounces sliced Category A cheese (see Note above)","Kosher salt","1/2 ounce category B cheese, grated (optional; see Note above)","Brown mustard"],"extracted_instructions":["1. Melt 1/2 tablespoon of the butter in a 12-inch stainless steel or cast-iron skillet over medium heat. Add 2 bread slices and swirl them around the pan with your hands until all the butter is absorbed. Cook, swirling the bread occasionally, until very lightly browned, about 1 minute. Remove to a cutting board, toasted side up, and immediately top with the sliced A cheese. Melt another 1/2 tablespoon butter in the skillet and toast the remaining 2 bread slices until lightly browned, then immediately press them toasted side down onto the cheese-topped slices to form sandwiches.","2. Melt another 1/2 tablespoon butter in the skillet and sprinkle with a pinch of salt. Reduce the heat to medium-low and place the sandwiches in the skillet. Swirl them around with your hands until all the butter is absorbed. Cook the sandwiches, swirling them with your hands and pressing down on them gently with a wide stiff spatula occasionally, until the bottoms are a deep, even golden brown, about 4 minutes. Remove the sandwiches to your cutting board with the spatula. Melt the remaining 1/2 tablespoon butter in the skillet, sprinkle with a bit of salt, and repeat the toasting procedure with the second side, until the sandwiches are golden brown on both sides and the cheese is thoroughly melted, about 4 minutes longer. Transfer the sandwiches to the cutting board.","3. If desired, spread the grated cheese evenly over a large plate. Press the sandwiches into the grated cheese, turning once and pressing on them until you get an even coating of cheese on both sides. Return the sandwiches to the skillet and cook until the grated cheese has melted and formed a golden brown crust, about 1 minute. Carefully flip the sandwiches and repeat with the second side. Transfer to the cutting board."],"field_evidence":"{\"name\":\"blocks.b1430\",\"description\":\"blocks.b1431; blocks.b1432\",\"recipeYield\":\"blocks.b1433\",\"recipeIngredient\":\"blocks.b1433\",\"recipeInstructions\":\"blocks.b1434; blocks.b1435; blocks.b1436\"}","warnings":[]}