{"bundle_version":"1","recipe_id":"urn:recipeimport:epub:3d419982b11ed7c2503ba73deac8b6964c077c685dbd9ac199387b6a5504ed58:c1","schemaorg_recipe":"{\"@context\":\"https://schema.org\",\"@type\":\"Recipe\",\"name\":\"A PORRIDGE OF LOVAGE STEMS\",\"description\":\"I had never cooked with lovage before moving to Denmark, but it's an amazing herb that grows rampant on Lummi. Here, we started by using the plant for several dishes, making infusions from the leaves and turning the seeds into capers, but we always had a large bin of lovage stems that ended up in the compost heap.\\nIn the spring, lovage is tender and subtle, an almost entirely different plant than it is later in the year. This dish is best prepared before the plant bolts and flowers, when the stems are crisp, juicy, and pleasant to eat raw. The preparation resembles a risotto, with the lovage stems in place of rice, gradually softened while cooking in a smoky smelt stock. The consistency should be similar to risotto, too, with a creaminess achieved by mixing in a thick pur\\u00e9e of blanched spinach and adding a knob of butter at the end. This porridge can easily be a stand-alone dish, but I tend to serve it alongside some caramelized shellfish, such as razor clams or small squid.\",\"recipeYield\":\"6 TO 8\",\"recipeIngredient\":[\"3 scallions\",\"1/3 cup/80 g\",\"smelt stock\",\"1 cup/90 g lovage stems, cut into 1/4-inch/.5 cm lengths\",\"1 cup/12 g lovage leaves, torn into pieces smaller than 1 inch/2.5 cm\",\"1/2 cup/45 g rainbow chard stems, cut into 1/4-inch/.5 cm cubes\",\"1/2 cup/50 g rainbow chard leaves, torn into thumb-sized pieces\",\"Salt\"],\"recipeInstructions\":[{\"@type\":\"HowToStep\",\"text\":\"In the spring, lovage is tender and subtle, an almost entirely different plant than it is later in the year. This dish is best prepared before the plant bolts and flowers, when the stems are crisp, juicy, and pleasant to eat raw. The preparation resembles a risotto, with the lovage stems in place of rice, gradually softened while cooking in a smoky smelt stock. The consistency should be similar to risotto, too, with a creaminess achieved by mixing in a thick pur\\u00e9e of blanched spinach and adding a knob of butter at the end. This porridge can easily be a stand-alone dish, but I tend to serve it alongside some caramelized shellfish, such as razor clams or small squid.\"},{\"@type\":\"HowToStep\",\"text\":\"The smelt stock used in this porridge is a good one, something of a mother sauce here at The Willows. We clean, salt, smoke, and dry the small fish before infusing them into a broth with dried mushrooms.\"}]}","extracted_ingredients":["3 scallions","1/3 cup/80 g","smelt stock","1 cup/90 g lovage stems, cut into 1/4-inch/.5 cm lengths","1 cup/12 g lovage leaves, torn into pieces smaller than 1 inch/2.5 cm","1/2 cup/45 g rainbow chard stems, cut into 1/4-inch/.5 cm cubes","1/2 cup/50 g rainbow chard leaves, torn into thumb-sized pieces","Salt"],"extracted_instructions":["In the spring, lovage is tender and subtle, an almost entirely different plant than it is later in the year. This dish is best prepared before the plant bolts and flowers, when the stems are crisp, juicy, and pleasant to eat raw. The preparation resembles a risotto, with the lovage stems in place of rice, gradually softened while cooking in a smoky smelt stock. The consistency should be similar to risotto, too, with a creaminess achieved by mixing in a thick purée of blanched spinach and adding a knob of butter at the end. This porridge can easily be a stand-alone dish, but I tend to serve it alongside some caramelized shellfish, such as razor clams or small squid.","The smelt stock used in this porridge is a good one, something of a mother sauce here at The Willows. We clean, salt, smoke, and dry the small fish before infusing them into a broth with dried mushrooms."],"field_evidence":"{\"name\":\"b108\",\"description\":[\"b109\",\"b110\",\"b111\"],\"recipeYield\":[\"b112\",\"b113\"],\"recipeIngredient\":[\"b114\",\"b115\",\"b116\",\"b118\",\"b119\",\"b120\",\"b121\",\"b122\"],\"recipeInstructions\":[\"b110\",\"b111\"]}","warnings":["Ingredient quantity and item text are split across separate lines ('1/3 cup/80 g' and 'smelt stock').","No explicit step-by-step instruction list is present; instructions were captured from narrative lines only."]}