{"bundle_version":"1","recipe_id":"urn:recipeimport:epub:25814f413ce3cebb29af76fb45b8bef12928240886abe3d672e85f7e0be88761:c30","schemaorg_recipe":"{\"@context\":\"https://schema.org/\",\"@type\":\"Recipe\",\"name\":\"CRISPY FRIED BACON\",\"recipeYield\":\"SERVES 2 TO 4\",\"recipeIngredient\":[\"SERVES 2 TO 4 8 slices bacon, cut crosswise in half\"]}","extracted_ingredients":["SERVES 2 TO 4 8 slices bacon, cut crosswise in half"],"extracted_instructions":[],"field_evidence":"{\"name\":{\"block_id\":\"b907\",\"text\":\"CRISPY FRIED BACON\"},\"recipeYield\":{\"block_id\":\"b908\",\"text\":\"SERVES 2 TO 4 8 slices bacon, cut crosswise in half\"},\"recipeIngredient\":{\"block_id\":\"b908\",\"text\":\"SERVES 2 TO 4 8 slices bacon, cut crosswise in half\"},\"canonical_text\":\"CRISPY FRIED BACON\\nSERVES 2 TO 4 8 slices bacon, cut crosswise in half\"}","warnings":["No preparation or cooking instructions are present in the source; only title and a combined yield/ingredient line are available."]}