{"bundle_version":"1","recipe_id":"urn:recipeimport:epub:3d419982b11ed7c2503ba73deac8b6964c077c685dbd9ac199387b6a5504ed58:c6","schemaorg_recipe":"{\"@context\":\"https://schema.org\",\"@type\":\"Recipe\",\"name\":\"SLICES OF PORCINI MUSHROOMS WITH GRILLED ASPARAGUS JUICES\",\"recipeYield\":\"4\",\"recipeIngredient\":[\"1/4 cup/60 g high-quality unsalted butter\",\"2 ounces/60 g porcini mushrooms, roughly chopped\",\"14 large asparagus spears (about 210 g), trimmed\",\"Salt\",\"4 ounces/115 g porcini mushrooms\",\"1 teaspoon/5 g spinach purée (page 247)\",\"Salt\",\"3 tablespoons/40 g woodruff oil\",\"28 woodruff flowers\"],\"recipeInstructions\":[\"Preheat a sous vide water bath to 176°F/80°C and place the butter and the roughly chopped porcinis in a sous vide bag. Vacuum seal the bag on high and cook it in the water bath for 8 hours, then run the butter through a fine-mesh strainer. Discard the solids.\",\"Prepare a hot fire for direct grilling, and when it's ready, grill the asparagus until deep grill marks appear, about 3 minutes. Flip and cook for about 3 more minutes. The spears should still be al dente. Immediately place them on a quarter-sheet pan and tightly wrap the pan with plastic wrap, letting them sit until they're cooked through, 5 to 10 minutes.\",\"Run the grilled asparagus through a juicer and season the juice with salt to taste. You should have about 1/2 cup of juice.\",\"Clean all of the whole porcini by scraping their stems with a bird's-beak knife, then wipe the whole mushrooms down with a damp paper towel to give them a polished look. Cut the 2 best-looking porcini in half lengthwise and use a mandoline to slice those lengthwise about\",\"inch/2 mm thick.\",\"Combine the asparagus juice, spinach purée, and a pinch of salt in a small saucepan over low heat.\",\"In another small saucepan, heat a tablespoon of porcini butter, a few drops of water, and a sprinkle of salt over low heat, then add the sliced porcini and cook, stirring gently, until they are meltingly tender and almost creamy.\",\"Arrange the cooked, sliced mushrooms at the bottom of each serving plate. Spoon a quarter of the warmed asparagus juice and 2 teaspoons of woodruff oil onto each plate, along with about 7 woodruff flowers. At the table, use a truffle slicer to shave about 8 paper-thin slices of the whole, raw porcini on top of each dish.\"],\"@id\":\"urn:recipeimport:epub:3d419982b11ed7c2503ba73deac8b6964c077c685dbd9ac199387b6a5504ed58:c6\"}","extracted_ingredients":["1/4 cup/60 g high-quality unsalted butter","2 ounces/60 g porcini mushrooms, roughly chopped","14 large asparagus spears (about 210 g), trimmed","Salt","4 ounces/115 g porcini mushrooms","1 teaspoon/5 g spinach purée (page 247)","Salt","3 tablespoons/40 g woodruff oil","28 woodruff flowers"],"extracted_instructions":["Preheat a sous vide water bath to 176°F/80°C and place the butter and the roughly chopped porcinis in a sous vide bag. Vacuum seal the bag on high and cook it in the water bath for 8 hours, then run the butter through a fine-mesh strainer. Discard the solids.","Prepare a hot fire for direct grilling, and when it's ready, grill the asparagus until deep grill marks appear, about 3 minutes. Flip and cook for about 3 more minutes. The spears should still be al dente. Immediately place them on a quarter-sheet pan and tightly wrap the pan with plastic wrap, letting them sit until they're cooked through, 5 to 10 minutes.","Run the grilled asparagus through a juicer and season the juice with salt to taste. You should have about 1/2 cup of juice.","Clean all of the whole porcini by scraping their stems with a bird's-beak knife, then wipe the whole mushrooms down with a damp paper towel to give them a polished look. Cut the 2 best-looking porcini in half lengthwise and use a mandoline to slice those lengthwise about","inch/2 mm thick.","Combine the asparagus juice, spinach purée, and a pinch of salt in a small saucepan over low heat.","In another small saucepan, heat a tablespoon of porcini butter, a few drops of water, and a sprinkle of salt over low heat, then add the sliced porcini and cook, stirring gently, until they are meltingly tender and almost creamy.","Arrange the cooked, sliced mushrooms at the bottom of each serving plate. Spoon a quarter of the warmed asparagus juice and 2 teaspoons of woodruff oil onto each plate, along with about 7 woodruff flowers. At the table, use a truffle slicer to shave about 8 paper-thin slices of the whole, raw porcini on top of each dish."],"field_evidence":"{\"name\":\"b233\",\"recipeYield\":\"b236\",\"recipeIngredient\":[\"b238\",\"b239\",\"b241\",\"b242\",\"b244\",\"b245\",\"b246\",\"b247\",\"b248\"],\"recipeInstructions\":[\"b250\",\"b252\",\"b253\",\"b255\",\"b256\",\"b258\",\"b259\",\"b260\"]}","warnings":[]}