{"bundle_version":"1","recipe_id":"urn:recipeimport:epub:25814f413ce3cebb29af76fb45b8bef12928240886abe3d672e85f7e0be88761:c23","schemaorg_recipe":"{\"@type\":\"Recipe\",\"name\":\"FOOLPROOF HOLLANDAISE SAUCE\",\"description\":\"NOTE : Cooled hollandaise can be very carefully reheated over the lowest-possible heat while whisking constantly. Hollandaise can't be refrigerated and then reheated.\",\"recipeIngredient\":[\"MAKES ABOUT 1 CUP 3 large egg yolks 1 tablespoon lemon juice (from 1 lemon) 1 tablespoon hot water 1/2 pound (2 sticks) unsalted butter, cut into rough tablespoon-sized chunks Pinch of cayenne pepper Kosher salt TO MAKE HOLLANDAISE WITH AN IMMERSION BLENDER\"],\"recipeInstructions\":[\"1. Add the egg yolks, lemon juice, and hot water to the blender cup (or a cup that will just barely hold the head of your blender).\",\"2. Melt the butter in a small saucepan over medium-low heat and continue to heat until the butter just begins to bubble and registers 180° to 190°F on an instant-read thermometer. Transfer it to a liquid measuring cup, leaving the thin layer of whitish liquid behind (discard it).\"]}","extracted_ingredients":["MAKES ABOUT 1 CUP 3 large egg yolks 1 tablespoon lemon juice (from 1 lemon) 1 tablespoon hot water 1/2 pound (2 sticks) unsalted butter, cut into rough tablespoon-sized chunks Pinch of cayenne pepper Kosher salt TO MAKE HOLLANDAISE WITH AN IMMERSION BLENDER"],"extracted_instructions":["1. Add the egg yolks, lemon juice, and hot water to the blender cup (or a cup that will just barely hold the head of your blender).","2. Melt the butter in a small saucepan over medium-low heat and continue to heat until the butter just begins to bubble and registers 180° to 190°F on an instant-read thermometer. Transfer it to a liquid measuring cup, leaving the thin layer of whitish liquid behind (discard it)."],"field_evidence":"{\"name\":\"blocks[0].text\",\"description\":\"blocks[1].text\",\"recipeIngredient\":[\"blocks[2].text\"],\"recipeInstructions\":[\"blocks[3].text\",\"blocks[4].text\"]}","warnings":[]}