{"bundle_version":"1","recipe_id":"urn:recipeimport:epub:25814f413ce3cebb29af76fb45b8bef12928240886abe3d672e85f7e0be88761:c39","schemaorg_recipe":"{\"@context\":\"https://schema.org\",\"@type\":\"Recipe\",\"name\":\"BASIC QUICK WAFFLES\",\"recipeYield\":\"MAKES 8 SMALL ROUND WAFFLES, FOUR 4-WELL BELGIAN-STYLE WAFFLES, OR 4 LARGE SQUARE WAFFLES, SERVING 4\",\"recipeIngredient\":[\"1 recipe Basic Dry Pancake Mix ( here )\",\"2 large eggs 11/2 cups buttermilk 4 tablespoons unsalted butter, melted 1 cup ice-cold club soda 1 teaspoon vanilla extract Butter or oil for the waffle iron Maple syrup\"],\"recipeInstructions\":[{\"@type\":\"HowToStep\",\"text\":\"1. Preheat an electric waffle iron, on the low-heat setting if you have the option, or a heat a stovetop waffle iron over medium-low heat. Place the dry mix in a large bowl.\"},{\"@type\":\"HowToStep\",\"text\":\"2. In a medium bowl, whisk the egg whites until stiff peaks form. In a clean large bowl, whisk the egg yolks and buttermilk until homogeneous. Slowly drizzle in the butter while whisking. Carefully fold the egg whites into the yolk mixture with a rubber spatula until just combined. Fold in the soda water. Pour the mixture over the dry mix and fold until just combined (there should still be plenty of lumps).\"},{\"@type\":\"HowToStep\",\"text\":\"3. If using a 7-inch round stovetop waffle iron, ladle 1/2 cup of batter into the iron and cook, flipping it occasionally, until the waffle is golden brown and crisp on both sides, about 8 minutes. If using a Belgian waffle iron, scoop 1/4 cup batter into each well, close the iron, and immediately flip it, then continue cooking, turning occasionally, until the waffles are golden brown and crisp on both sides, about 10 minutes. If using an electric waffle iron, preheat and cook according to the manufacturer's instructions. Transfer to a plate, or keep warm on a rack on a baking sheet in a 200°F oven, and cook the remaining batches.\"]}","extracted_ingredients":["1 recipe Basic Dry Pancake Mix ( here )","2 large eggs 11/2 cups buttermilk 4 tablespoons unsalted butter, melted 1 cup ice-cold club soda 1 teaspoon vanilla extract Butter or oil for the waffle iron Maple syrup"],"extracted_instructions":["1. Preheat an electric waffle iron, on the low-heat setting if you have the option, or a heat a stovetop waffle iron over medium-low heat. Place the dry mix in a large bowl.","2. In a medium bowl, whisk the egg whites until stiff peaks form. In a clean large bowl, whisk the egg yolks and buttermilk until homogeneous. Slowly drizzle in the butter while whisking. Carefully fold the egg whites into the yolk mixture with a rubber spatula until just combined. Fold in the soda water. Pour the mixture over the dry mix and fold until just combined (there should still be plenty of lumps).","3. If using a 7-inch round stovetop waffle iron, ladle 1/2 cup of batter into the iron and cook, flipping it occasionally, until the waffle is golden brown and crisp on both sides, about 8 minutes. If using a Belgian waffle iron, scoop 1/4 cup batter into each well, close the iron, and immediately flip it, then continue cooking, turning occasionally, until the waffles are golden brown and crisp on both sides, about 10 minutes. If using an electric waffle iron, preheat and cook according to the manufacturer's instructions. Transfer to a plate, or keep warm on a rack on a baking sheet in a 200°F oven, and cook the remaining batches."],"field_evidence":"{\"name\":{\"blocks\":[\"b1061\"]},\"recipeYield\":{\"blocks\":[\"b1062\"]},\"recipeIngredient\":{\"blocks\":[\"b1063\",\"b1064\"]},\"recipeInstructions\":{\"blocks\":[\"b1065\",\"b1066\",\"b1067\"]}}","warnings":["Canonical text includes a heading for a likely separate recipe (\"ORANGE-SCENTED WAFFLES\") after the provided instruction steps, so extraction is limited to the preceding section only."]}