{"bundle_version":"1","recipe_id":"urn:recipeimport:epub:25814f413ce3cebb29af76fb45b8bef12928240886abe3d672e85f7e0be88761:c54","schemaorg_recipe":"{\"@context\":\"https://schema.org\",\"@type\":\"Recipe\",\"name\":\"FAST FRENCH ONION SOUP\",\"recipeYield\":\"4\",\"recipeIngredient\":[\"1 tablespoon sugar\",\"5 pounds yellow onions (about 5 large), finely sliced (about 71/2 cups)\",\"2 tablespoons unsalted butter\",\"1/4 teaspoon baking powder\",\"Kosher salt\",\"1/4 cup dry sherry\",\"6 cups homemade or low-sodium canned chicken stock\",\"2 bay leaves\",\"6 to 8 sprigs fresh thyme\",\"Freshly ground black pepper\",\"1 baguette, sliced 1/2 inch thick and toasted\",\"8 ounces Gruyère or Swiss cheese, grated\"],\"recipeInstructions\":[\"1. Pour the sugar into a large Dutch oven and cook over high heat, swirling the pot gently as the sugar melts, until it is completely liquid and a golden brown caramel. Add the onions and cook, stirring with a wooden spoon and tossing constantly until they are evenly coated in the caramel, about 30 seconds. Add the butter, baking powder, and 2 teaspoons salt and cook, stirring occasionally, until the onions are light golden brown and a brown coating has started to build up on the bottom of the pot, about 10 minutes.\",\"2. Add 2 tablespoons water and scrape the browned coating from the bottom of the pot. Shake the pot to distribute the onions evenly over the bottom and cook, shaking occasionally, until the liquid evaporates and the browned coating starts to build up again, about 5 minutes. Add 2 more tablespoons water and repeat, allowing the coating to build up and scraping it off, then repeat two more times. By this point, the onions should be a deep brown. If not, continue the deglazing and stirring process until the desired color is reached.\",\"3. Add the sherry, chicken stock, bay leaves, and thyme, bring to a boil, and reduce to a simmer. Simmer, uncovered, until the liquid is deeply flavored and slightly reduced, about 15 minutes. Season to taste with salt and pepper. Discard the bay leaves and thyme.\"]}","extracted_ingredients":["1 tablespoon sugar","5 pounds yellow onions (about 5 large), finely sliced (about 71/2 cups)","2 tablespoons unsalted butter","1/4 teaspoon baking powder","Kosher salt","1/4 cup dry sherry","6 cups homemade or low-sodium canned chicken stock","2 bay leaves","6 to 8 sprigs fresh thyme","Freshly ground black pepper","1 baguette, sliced 1/2 inch thick and toasted","8 ounces Gruyère or Swiss cheese, grated"],"extracted_instructions":["1. Pour the sugar into a large Dutch oven and cook over high heat, swirling the pot gently as the sugar melts, until it is completely liquid and a golden brown caramel. Add the onions and cook, stirring with a wooden spoon and tossing constantly until they are evenly coated in the caramel, about 30 seconds. Add the butter, baking powder, and 2 teaspoons salt and cook, stirring occasionally, until the onions are light golden brown and a brown coating has started to build up on the bottom of the pot, about 10 minutes.","2. Add 2 tablespoons water and scrape the browned coating from the bottom of the pot. Shake the pot to distribute the onions evenly over the bottom and cook, shaking occasionally, until the liquid evaporates and the browned coating starts to build up again, about 5 minutes. Add 2 more tablespoons water and repeat, allowing the coating to build up and scraping it off, then repeat two more times. By this point, the onions should be a deep brown. If not, continue the deglazing and stirring process until the desired color is reached.","3. Add the sherry, chicken stock, bay leaves, and thyme, bring to a boil, and reduce to a simmer. Simmer, uncovered, until the liquid is deeply flavored and slightly reduced, about 15 minutes. Season to taste with salt and pepper. Discard the bay leaves and thyme."],"field_evidence":"{\"name\":\"b1513\",\"recipeYield\":\"b1514\",\"recipeIngredient\":\"b1514\",\"recipeInstructions\":[\"b1515\",\"b1516\",\"b1517\"]}","warnings":["Ingredient list includes \"Kosher salt\" without a quantity, while step 1 specifies 2 teaspoons salt."]}